<?xml version="1.0" encoding="UTF-8"?>
<citas
  xmlns:xsi="http://www.w3.org/2001/XMLSchema-instance"  
  xsi:noNamespaceSchemaLocation="citas.xsd">
  <cita>
    <autor>examenf</autor>
    <fechas>1879 - 1935</fechas>
    <texto>Todo ha cambiado. La gente se toma a los humoristas en serio y a los políticos en broma.</texto>
  </cita>
  <cita>
    <autor>Groucho Marx</autor>
    <fechas>1890 - 1977</fechas>
    <texto>No reírse de nada es de tontos, reírse de todo es de estúpidos.</texto>
  </cita>
  <cita>
    <autor>Isaac Asimov</autor>
    <fechas>1920 - 1992</fechas>
    <texto>La primera ley de la dietética parece ser: si está bueno, es malo para usted.</texto>
  </cita>
  <cita>
    <autor> El profesor </autor>
    <fechas>1952 - </fechas>
    <texto>La forma de empezar es dejar de hablar y empezar a hacer. </texto>
  </cita>
</citas>